{
  "fields": [
    {
      "name": "PAYLOAD",
      "offset": 0,
      "pic": "X(5)",
      "scale": 0,
      "sign": "none",
      "usage": "DISPLAY",
      "width": 5
    }
  ],
  "manifest_version": 1,
  "program_id": "status-two-read-01",
  "record_width": 5,
  "source_sha256": "b17b084d896a5ad81bb3584d582690c4f62d73cff07c87db797e5cc3be6af0c3"
}
