{
  "fields": [
    {
      "name": "OUT-TEXT",
      "offset": 0,
      "pic": "X(2)",
      "scale": 0,
      "sign": "none",
      "usage": "DISPLAY",
      "width": 2
    },
    {
      "name": "OUT-ORDER",
      "offset": 2,
      "pic": "9(1)",
      "scale": 0,
      "sign": "none",
      "usage": "DISPLAY",
      "width": 1
    },
    {
      "name": "OUT-MARK",
      "offset": 3,
      "pic": "X(1)",
      "scale": 0,
      "sign": "none",
      "usage": "DISPLAY",
      "width": 1
    }
  ],
  "manifest_version": 1,
  "program_id": "status-two-read-03",
  "record_width": 4,
  "source_sha256": "5cf93258b79954af2333bc876c4ed7ee75276ff4f0044388f7bbd0a228989c88"
}
