{
  "fields": [
    {
      "name": "OUT-TEXT",
      "offset": 0,
      "pic": "X(3)",
      "scale": 0,
      "sign": "none",
      "usage": "DISPLAY",
      "width": 3
    },
    {
      "name": "OUT-MARK",
      "offset": 3,
      "pic": "X(1)",
      "scale": 0,
      "sign": "none",
      "usage": "DISPLAY",
      "width": 1
    }
  ],
  "manifest_version": 1,
  "program_id": "status-fallback-04",
  "record_width": 4,
  "source_sha256": "4c23d24d22e8fbd3fd09fc4df4ad1f687dfe9fb8e5c20f3237e0f1ea738f9304"
}
