{
  "fields": [
    {
      "name": "OUT-TOTAL",
      "offset": 0,
      "pic": "S9(3)V9(2)",
      "scale": 2,
      "sign": "leading_separate",
      "usage": "DISPLAY",
      "width": 6
    },
    {
      "name": "OUT-MARK",
      "offset": 6,
      "pic": "X(1)",
      "scale": 0,
      "sign": "none",
      "usage": "DISPLAY",
      "width": 1
    }
  ],
  "manifest_version": 1,
  "program_id": "fee-chain-03",
  "record_width": 7,
  "source_sha256": "9d3f6512d0cc7315de1e35b7de3e0abad8d90224368e7d5da2f8a53544fb838a"
}
