{
  "fields": [
    {
      "name": "AMOUNT",
      "offset": 0,
      "pic": "9(3)V9(2)",
      "scale": 2,
      "sign": "none",
      "usage": "DISPLAY",
      "width": 5
    },
    {
      "name": "SIGNED-DEBT",
      "offset": 5,
      "pic": "S9(2)V9(2)",
      "scale": 2,
      "sign": "leading_separate",
      "usage": "DISPLAY",
      "width": 5
    }
  ],
  "manifest_version": 1,
  "program_id": "fee-tier-01",
  "record_width": 10,
  "source_sha256": "ea3d69ee5bca97599ec13883bcc60e88f5c5abe1b6d8f0a3f00af92a8f55afe5"
}
